<?xml version="1.0" encoding="utf-8"?>
<!DOCTYPE lista_ventas SYSTEM "ejercicio3.1.dtd">
<lista_ventas>
  <venta>
    <importe>45345</importe>
    <comprador>Jhonatan</comprador>
    <vendedor>Armando</vendedor>
    <codigo_factura>5345345</codigo_factura>
  </venta>
  <venta>
    <importe>453045</importe>
    <comprador>Carlos</comprador>
    <vendedor>Juan</vendedor>
    <fecha>
      <dia>12</dia>
      <mes>02</mes>
      <anio>2023</anio>
    </fecha>
    <codigo_factura>1345345</codigo_factura>
  </venta>
</lista_ventas>